List Size = 101
Min/Max sequential Sort Rate: 16.3/53.2 Mega-Elements/Second
Max Threads (from omp_get_max_threads) = 8

 Starting new run 
NT: 1

Final Sorting
 1 2 3 4 5 6 7 8 9 10 11 12 13 14 15 16 17 18 19 20 21 22 23 24 25 26 27 28 29 30 31 32 33 34 35 36 37 38 39 40 41 42 43 44 45 46 47 48 49 50 51 52 53 54 55 56 57 58 59 60 61 62 63 64 65 66 67 68 69 70 71 72 73 74 75 76 77 78 79 80 81 82 83 84 85 86 87 88 89 90 91 92 93 94 95 96 97 98 99 100
Finished run

 Starting new run 
NT: 1

Final Sorting
 1 2 3 4 5 6 7 8 9 10 11 12 13 14 15 16 17 18 19 20 21 22 23 24 25 26 27 28 29 30 31 32 33 34 35 36 37 38 39 40 41 42 43 44 45 46 47 48 49 50 51 52 53 54 55 56 57 58 59 60 61 62 63 64 65 66 67 68 69 70 71 72 73 74 75 76 77 78 79 80 81 82 83 84 85 86 87 88 89 90 91 92 93 94 95 96 97 98 99 100
Finished run

 Starting new run 
NT: 1

Final Sorting
 1 2 3 4 5 6 7 8 9 10 11 12 13 14 15 16 17 18 19 20 21 22 23 24 25 26 27 28 29 30 31 32 33 34 35 36 37 38 39 40 41 42 43 44 45 46 47 48 49 50 51 52 53 54 55 56 57 58 59 60 61 62 63 64 65 66 67 68 69 70 71 72 73 74 75 76 77 78 79 80 81 82 83 84 85 86 87 88 89 90 91 92 93 94 95 96 97 98 99 100
Finished run

 Starting new run 
NT: 2
T:0 I:1 N/I: 1
Merge on thread:0 S:0 M:50 E:100

Final Sorting
 1 2 3 4 5 6 7 8 9 10 11 12 13 14 15 16 17 18 19 20 21 22 23 24 25 26 27 28 29 30 31 32 33 34 35 36 37 38 39 40 41 42 43 44 45 46 47 48 49 50 51 52 53 54 55 56 57 58 59 60 61 62 63 64 65 66 67 68 69 70 71 72 73 74 75 76 77 78 79 80 81 82 83 84 85 86 87 88 89 90 91 92 93 94 95 96 97 98 99 100
Finished run

 Starting new run 
NT: 2
T:0 I:1 N/I: 1
Merge on thread:0 S:0 M:50 E:100

Final Sorting
 1 2 3 4 5 6 7 8 9 10 11 12 13 14 15 16 17 18 19 20 21 22 23 24 25 26 27 28 29 30 31 32 33 34 35 36 37 38 39 40 41 42 43 44 45 46 47 48 49 50 51 52 53 54 55 56 57 58 59 60 61 62 63 64 65 66 67 68 69 70 71 72 73 74 75 76 77 78 79 80 81 82 83 84 85 86 87 88 89 90 91 92 93 94 95 96 97 98 99 100
Finished run

 Starting new run 
NT: 2
T:0 I:1 N/I: 1
Merge on thread:0 S:0 M:50 E:100

Final Sorting
 1 2 3 4 5 6 7 8 9 10 11 12 13 14 15 16 17 18 19 20 21 22 23 24 25 26 27 28 29 30 31 32 33 34 35 36 37 38 39 40 41 42 43 44 45 46 47 48 49 50 51 52 53 54 55 56 57 58 59 60 61 62 63 64 65 66 67 68 69 70 71 72 73 74 75 76 77 78 79 80 81 82 83 84 85 86 87 88 89 90 91 92 93 94 95 96 97 98 99 100
Finished run

 Starting new run 
NT: 3
T:0 I:1 N/I: 1
Merge on thread:0 S:0 M:50 E:100

Final Sorting
 52 53 54 55 56 57 58 59 60 61 62 63 64 65 66 67 1 2 3 4 5 6 7 8 9 10 11 12 13 14 15 16 17 18 19 20 21 22 23 24 25 26 27 28 29 30 31 32 33 34 68 69 70 71 72 73 74 75 76 77 78 79 80 81 82 83 84 85 86 87 88 89 90 91 92 93 94 95 96 97 98 99 100 101 35 36 37 38 39 40 41 42 43 44 45 46 47 48 49 50
Finished run

 Starting new run 
NT: 3
T:0 I:1 N/I: 1
Merge on thread:0 S:0 M:50 E:100

Final Sorting
 52 53 54 55 56 57 58 59 60 61 62 63 64 65 66 67 1 2 3 4 5 6 7 8 9 10 11 12 13 14 15 16 17 18 19 20 21 22 23 24 25 26 27 28 29 30 31 32 33 34 68 69 70 71 72 73 74 75 76 77 78 79 80 81 82 83 84 85 86 87 88 89 90 91 92 93 94 95 96 97 98 99 100 101 35 36 37 38 39 40 41 42 43 44 45 46 47 48 49 50
Finished run

 Starting new run 
NT: 3
T:0 I:1 N/I: 1
Merge on thread:0 S:0 M:50 E:100

Final Sorting
 52 53 54 55 56 57 58 59 60 61 62 63 64 65 66 67 1 2 3 4 5 6 7 8 9 10 11 12 13 14 15 16 17 18 19 20 21 22 23 24 25 26 27 28 29 30 31 32 33 34 68 69 70 71 72 73 74 75 76 77 78 79 80 81 82 83 84 85 86 87 88 89 90 91 92 93 94 95 96 97 98 99 100 101 35 36 37 38 39 40 41 42 43 44 45 46 47 48 49 50
Finished run
Sorting error: A[15]=67; A[16]=1
Sorting error: A[83]=101; A[84]=35

 Starting new run 
NT: 7
T:1 I:1 N/I: 3
T:0 I:1 N/I: 3
Merge on thread:0 S:0 M:14 E:28
Merge on thread:1 S:29 M:42 E:56
T:2 I:1 N/I: 3
Merge on thread:2 S:57 M:78 E:100
Doing 3-Way merge
T:0 I:1 N/I: 3
Merge on thread:0 S:0 M:28 E:56
T:0 I:1 N/I: 3
Merge on thread:0 S:0 M:56 E:100

Final Sorting
 25 26 27 28 29 30 1 2 3 4 5 6 7 8 9 10 11 12 13 14 15 16 31 32 33 34 35 36 37 38 39 40 41 42 43 44 17 18 19 20 21 22 23 24 45 46 47 48 49 50 51 52 53 54 55 56 57 58 59 60 61 62 63 64 65 66 67 68 69 70 71 72 73 74 75 76 77 78 79 80 81 82 83 84 85 86 87 88 89 90 91 92 93 94 95 96 97 98 99 100
Finished run

 Starting new run 
NT: 7
T:1 I:1 N/I: 3
T:0 I:1 N/I: 3
Merge on thread:0 S:0 M:14 E:28
T:2 I:1 N/I: 3
Merge on thread:1 S:29 M:42 E:56
Merge on thread:2 S:57 M:78 E:100
Doing 3-Way merge
T:0 I:1 N/I: 3
Merge on thread:0 S:0 M:28 E:56
T:0 I:1 N/I: 3
Merge on thread:0 S:0 M:56 E:100

Final Sorting
 25 26 27 28 29 30 1 2 3 4 5 6 7 8 9 10 11 12 13 14 15 16 31 32 33 34 35 36 37 38 39 40 41 42 43 44 17 18 19 20 21 22 23 24 45 46 47 48 49 50 51 52 53 54 55 56 57 58 59 60 61 62 63 64 65 66 67 68 69 70 71 72 73 74 75 76 77 78 79 80 81 82 83 84 85 86 87 88 89 90 91 92 93 94 95 96 97 98 99 100
Finished run

 Starting new run 
NT: 7
T:1 I:1 N/I: 3
T:0 I:1 N/I: 3
Merge on thread:0 S:0 M:14 E:28
T:2 I:1 N/I: 3
Merge on thread:1 S:29 M:42 E:56
Merge on thread:2 S:57 M:78 E:100
Doing 3-Way merge
T:0 I:1 N/I: 3
Merge on thread:0 S:0 M:28 E:56
T:0 I:1 N/I: 3
Merge on thread:0 S:0 M:56 E:100

Final Sorting
 25 26 27 28 29 30 1 2 3 4 5 6 7 8 9 10 11 12 13 14 15 16 31 32 33 34 35 36 37 38 39 40 41 42 43 44 17 18 19 20 21 22 23 24 45 46 47 48 49 50 51 52 53 54 55 56 57 58 59 60 61 62 63 64 65 66 67 68 69 70 71 72 73 74 75 76 77 78 79 80 81 82 83 84 85 86 87 88 89 90 91 92 93 94 95 96 97 98 99 100
Finished run
Sorting error: A[5]=30; A[6]=1
Sorting error: A[35]=44; A[36]=17
Best & Worst Performance of parallelized version: Mega-Elts/second || Speedup on 1/2/3/7 threads
Best Performance (Mega-Elts/second || Speedup): 3.1 7.7 8.3 3.0  || 0.1 0.1 0.2 0.1 
Worst Performance (Mega-Elts/second || Speedup): 0.4 0.7 0.8 0.3  || 0.0 0.0 0.0 0.0 
